{
  "schema_version": "1.0",
  "claim_id": "CLM-ET-W2-003-95833A36",
  "task_id": "ET-W2-003",
  "worker_id": "claude-sonnet-4-6",
  "lane_id": "L01",
  "claimed_at": "2026-07-11T10:52:35.504183+00:00",
  "heartbeat_at": "2026-07-11T10:52:35.504183+00:00",
  "lease_expires_at": "2026-07-11T14:52:35.504204+00:00",
  "repository_revision": "19546fee2b9aea22c5de152e6e241ede17b4d325",
  "lock_ids": [],
  "attempt_id": null,
  "status": "RELEASED",
  "released_at": "2026-07-11T11:07:20.868385+00:00"
}
